{"excluded_instance_ids":["psf__requests_v2.27.0_v2.27.1"],"population":{"counts_by_stratum":{"high":15,"low":21,"medium":12},"eligible_counts_by_stratum":{"high":15,"low":20,"medium":12},"eligible_row_count":47,"source_row_count":48},"projection_sha256":"f103e61548af36b41ad5b32f6e05941827ab52ace24ec3ce4c1663ca01cb88e1","proxy":{"extraction_rule":"len(instance[\"PRs\"])","gold_blind":true,"name":"dataset_pr_record_count","per_instance_count_retention":"discarded_after_stratification","source_field":"PRs"},"routing_manifest":{"manifest":{"allowlisted_fields":["instance_id","repository","complexity_stratum","language","tags"],"dataset":{"artifact_path":"hf_out/hf_dataset/test/data-00000-of-00001.arrow","artifact_sha256":"74e7c63160ada4ceba71d5d89a9bb7c9794f4574b384458d546eb65cdb730520","benchmark":"swe_evo","row_count":48,"source_commit":"9b83d5af943ba7a17567336f5b18239f73960219","source_repository":"https://github.com/SWE-EVO/SWE-EVO.git","split":"test"},"gold_visibility":"evaluator_only","metadata":{"benchmark":"swe_evo","instances":[{"complexity_stratum":"high","instance_id":"conan-io__conan_2.0.14_2.0.15","language":"python","repository":"conan-io/conan","tags":[]},{"complexity_stratum":"high","instance_id":"conan-io__conan_2.0.2_2.0.3","language":"python","repository":"conan-io/conan","tags":[]},{"complexity_stratum":"high","instance_id":"dask__dask_2022.9.2_2022.10.0","language":"python","repository":"dask/dask","tags":[]},{"complexity_stratum":"low","instance_id":"dask__dask_2023.3.2_2023.4.0","language":"python","repository":"dask/dask","tags":[]},{"complexity_stratum":"low","instance_id":"dask__dask_2023.6.0_2023.6.1","language":"python","repository":"dask/dask","tags":[]},{"complexity_stratum":"low","instance_id":"dask__dask_2023.6.1_2023.7.0","language":"python","repository":"dask/dask","tags":[]},{"complexity_stratum":"low","instance_id":"dask__dask_2023.8.0_2023.8.1","language":"python","repository":"dask/dask","tags":[]},{"complexity_stratum":"low","instance_id":"dask__dask_2023.9.2_2023.9.3","language":"python","repository":"dask/dask","tags":[]},{"complexity_stratum":"low","instance_id":"dask__dask_2024.1.0_2024.1.1","language":"python","repository":"dask/dask","tags":[]},{"complexity_stratum":"low","instance_id":"dask__dask_2024.3.1_2024.4.0","language":"python","repository":"dask/dask","tags":[]},{"complexity_stratum":"low","instance_id":"iterative__dvc_0.30.0_0.30.1","language":"python","repository":"iterative/dvc","tags":[]},{"complexity_stratum":"medium","instance_id":"iterative__dvc_0.33.1_0.34.0","language":"python","repository":"iterative/dvc","tags":[]},{"complexity_stratum":"low","instance_id":"iterative__dvc_0.35.3_0.35.4","language":"python","repository":"iterative/dvc","tags":[]},{"complexity_stratum":"high","instance_id":"iterative__dvc_0.52.1_0.53.1","language":"python","repository":"iterative/dvc","tags":[]},{"complexity_stratum":"medium","instance_id":"iterative__dvc_0.89.0_0.90.0","language":"python","repository":"iterative/dvc","tags":[]},{"complexity_stratum":"medium","instance_id":"iterative__dvc_0.91.2_0.91.3","language":"python","repository":"iterative/dvc","tags":[]},{"complexity_stratum":"medium","instance_id":"iterative__dvc_0.92.0_0.92.1","language":"python","repository":"iterative/dvc","tags":[]},{"complexity_stratum":"high","instance_id":"iterative__dvc_1.0.0a1_1.0.0a2","language":"python","repository":"iterative/dvc","tags":[]},{"complexity_stratum":"low","instance_id":"iterative__dvc_1.0.0b6_1.0.0","language":"python","repository":"iterative/dvc","tags":[]},{"complexity_stratum":"high","instance_id":"iterative__dvc_1.0.1_1.0.2","language":"python","repository":"iterative/dvc","tags":[]},{"complexity_stratum":"low","instance_id":"iterative__dvc_1.1.0_1.1.1","language":"python","repository":"iterative/dvc","tags":[]},{"complexity_stratum":"medium","instance_id":"iterative__dvc_1.1.7_1.1.8","language":"python","repository":"iterative/dvc","tags":[]},{"complexity_stratum":"high","instance_id":"iterative__dvc_1.10.2_1.11.0","language":"python","repository":"iterative/dvc","tags":[]},{"complexity_stratum":"low","instance_id":"iterative__dvc_1.11.12_1.11.13","language":"python","repository":"iterative/dvc","tags":[]},{"complexity_stratum":"low","instance_id":"iterative__dvc_1.6.3_1.6.4","language":"python","repository":"iterative/dvc","tags":[]},{"complexity_stratum":"medium","instance_id":"iterative__dvc_2.19.0_2.20.0","language":"python","repository":"iterative/dvc","tags":[]},{"complexity_stratum":"low","instance_id":"iterative__dvc_2.21.1_2.21.2","language":"python","repository":"iterative/dvc","tags":[]},{"complexity_stratum":"high","instance_id":"iterative__dvc_2.5.0_2.5.1","language":"python","repository":"iterative/dvc","tags":[]},{"complexity_stratum":"low","instance_id":"iterative__dvc_2.58.1_2.58.2","language":"python","repository":"iterative/dvc","tags":[]},{"complexity_stratum":"high","instance_id":"iterative__dvc_2.7.2_2.7.3","language":"python","repository":"iterative/dvc","tags":[]},{"complexity_stratum":"high","instance_id":"iterative__dvc_2.8.1_2.8.2","language":"python","repository":"iterative/dvc","tags":[]},{"complexity_stratum":"medium","instance_id":"iterative__dvc_3.12.0_3.13.0","language":"python","repository":"iterative/dvc","tags":[]},{"complexity_stratum":"medium","instance_id":"iterative__dvc_3.13.3_3.14.0","language":"python","repository":"iterative/dvc","tags":[]},{"complexity_stratum":"low","instance_id":"iterative__dvc_3.15.0_3.15.1","language":"python","repository":"iterative/dvc","tags":[]},{"complexity_stratum":"high","instance_id":"iterative__dvc_3.4.0_3.5.0","language":"python","repository":"iterative/dvc","tags":[]},{"complexity_stratum":"low","instance_id":"iterative__dvc_3.43.1_3.44.0","language":"python","repository":"iterative/dvc","tags":[]},{"complexity_stratum":"medium","instance_id":"modin-project__modin_0.24.0_0.24.1","language":"python","repository":"modin-project/modin","tags":[]},{"complexity_stratum":"medium","instance_id":"modin-project__modin_0.25.0_0.25.1","language":"python","repository":"modin-project/modin","tags":[]},{"complexity_stratum":"medium","instance_id":"modin-project__modin_0.27.0_0.27.1","language":"python","repository":"modin-project/modin","tags":[]},{"complexity_stratum":"low","instance_id":"psf__requests_v2.12.2_v2.12.3","language":"python","repository":"psf/requests","tags":[]},{"complexity_stratum":"low","instance_id":"psf__requests_v2.27.0_v2.27.1","language":"python","repository":"psf/requests","tags":[]},{"complexity_stratum":"high","instance_id":"psf__requests_v2.4.0_v2.4.1","language":"python","repository":"psf/requests","tags":[]},{"complexity_stratum":"medium","instance_id":"psf__requests_v2.9.0_v2.9.1","language":"python","repository":"psf/requests","tags":[]},{"complexity_stratum":"high","instance_id":"pydantic__pydantic_v2.6.0b1_v2.6.0","language":"python","repository":"pydantic/pydantic","tags":[]},{"complexity_stratum":"high","instance_id":"pydantic__pydantic_v2.7.0_v2.7.1","language":"python","repository":"pydantic/pydantic","tags":[]},{"complexity_stratum":"high","instance_id":"pydantic__pydantic_v2.7.1_v2.7.2","language":"python","repository":"pydantic/pydantic","tags":[]},{"complexity_stratum":"low","instance_id":"scikit-learn__scikit-learn_0.20.1_0.20.2","language":"python","repository":"scikit-learn/scikit-learn","tags":[]},{"complexity_stratum":"low","instance_id":"scikit-learn__scikit-learn_0.21.1_0.21.2","language":"python","repository":"scikit-learn/scikit-learn","tags":[]}],"metadata_revision":"swe-evo-pr-count-r1","schema_version":"swe_evo_metadata.v1"}},"manifest_sha256":"ce7e368c34d2be326342134e6ad9c8bf6126b75b50f065bc2a309819c1def295","schema_version":"phase3_routing_manifest.v1"},"routing_manifest_sha256":"ce7e368c34d2be326342134e6ad9c8bf6126b75b50f065bc2a309819c1def295","schema_version":"phase3_complexity_projection.v1","source":{"artifact_path":"hf_out/hf_dataset/test/data-00000-of-00001.arrow","artifact_sha256":"74e7c63160ada4ceba71d5d89a9bb7c9794f4574b384458d546eb65cdb730520","benchmark":"swe_evo","row_count":48,"source_commit":"9b83d5af943ba7a17567336f5b18239f73960219","source_repository":"https://github.com/SWE-EVO/SWE-EVO.git","split":"test"},"stratum_boundaries":[{"maximum":2,"minimum":0,"stratum":"low"},{"maximum":6,"minimum":3,"stratum":"medium"},{"maximum":null,"minimum":7,"stratum":"high"}]}
